<InscriptionRequest xmlns="http://iaws/ws/contractfirst/carpooling" xmlns:xsi="http://www.w3.org/2001/XMLSchema-instance"
xsi:schemaLocation="http://iaws/ws/contractfirst/carpooling InscriptionRequest.xsd">
	<Id>
		<Lastname>Totoé</Lastname>
		<Firstname>TotoAussi</Firstname>
	</Id>
	<Mail>
		<Perso>toto</Perso>
		<Domain>univ-tlse3.fr</Domain>
	</Mail>
	<MailingAddress>
		<Street>Université Paul Sabatier</Street>
		<Code>31000</Code>
		<City>Toulouse</City>
	</MailingAddress>
</InscriptionRequest>
